{
  "contract_id": "ATC-POS-CONFORMANCE-001",
  "contract_version": "1.0.0-proposed",
  "status": "PROPOSED_NOT_NORMATIVE",
  "chain_id": 658467,
  "execution_semantics": "CONTRACT_VALIDATION_ONLY_UNTIL_FIXTURES_AND_PROTOCOL_PARAMETERS_ARE_FROZEN",
  "case_count": 19,
  "cases": [
    {
      "case_id": "POS-V-001",
      "kind": "positive",
      "title": "valid proposal",
      "contract_status": "BLOCKED",
      "blocked_by_parameters": [
        "PARAM-03",
        "PARAM-07"
      ],
      "input": {
        "contract_id": "ATC-POS-CONFORMANCE-001",
        "chain_id": 658467,
        "protocol_version": "UNFROZEN",
        "epoch": "FIXTURE:epoch_0",
        "height": "FIXTURE:height_1",
        "round": "FIXTURE:round_0",
        "validator_set_hash": "FIXTURE:validator_set_hash_0",
        "parent_block_id": "FIXTURE:parent_A",
        "scenario": {
          "proposal": "FIXTURE:valid_proposal_A",
          "proposer": "FIXTURE:eligible_leader_A",
          "signature": "FIXTURE:valid_proposal_signature_A",
          "parent": "FIXTURE:parent_A",
          "body": "FIXTURE:valid_body_A"
        }
      },
      "expected": {
        "decision": "ACCEPT",
        "error_code": "E_PROPOSAL_INVALID",
        "decision_is_normative": false,
        "error_code_is_normative": false
      },
      "fixture_status": "PLACEHOLDERS_UNRESOLVED",
      "notes": "Contract-only expected behavior. Not executable protocol evidence; resolve all fixture references and freeze applicable parameters before protocol execution."
    },
    {
      "case_id": "POS-V-002",
      "kind": "positive",
      "title": "valid vote scope",
      "contract_status": "BLOCKED",
      "blocked_by_parameters": [
        "PARAM-03",
        "PARAM-07",
        "PARAM-08"
      ],
      "input": {
        "contract_id": "ATC-POS-CONFORMANCE-001",
        "chain_id": 658467,
        "protocol_version": "UNFROZEN",
        "epoch": "FIXTURE:epoch_0",
        "height": "FIXTURE:height_1",
        "round": "FIXTURE:round_0",
        "validator_set_hash": "FIXTURE:validator_set_hash_0",
        "parent_block_id": "FIXTURE:parent_A",
        "scenario": {
          "vote": "FIXTURE:valid_vote_A",
          "vote_type": "PREVOTE",
          "signer": "FIXTURE:validator_A",
          "signature": "FIXTURE:valid_vote_signature_A",
          "binds": [
            "chain_id",
            "protocol_version",
            "epoch",
            "height",
            "round",
            "block_id",
            "validator_set_hash"
          ]
        }
      },
      "expected": {
        "decision": "ACCEPT",
        "error_code": "E_VOTE_SCOPE_INVALID",
        "decision_is_normative": false,
        "error_code_is_normative": false
      },
      "fixture_status": "PLACEHOLDERS_UNRESOLVED",
      "notes": "Contract-only expected behavior. Not executable protocol evidence; resolve all fixture references and freeze applicable parameters before protocol execution."
    },
    {
      "case_id": "POS-V-003",
      "kind": "positive",
      "title": "approved quorum finalizes",
      "contract_status": "BLOCKED",
      "blocked_by_parameters": [
        "PARAM-01",
        "PARAM-05",
        "PARAM-06"
      ],
      "input": {
        "contract_id": "ATC-POS-CONFORMANCE-001",
        "chain_id": 658467,
        "protocol_version": "UNFROZEN",
        "epoch": "FIXTURE:epoch_0",
        "height": "FIXTURE:height_1",
        "round": "FIXTURE:round_0",
        "validator_set_hash": "FIXTURE:validator_set_hash_0",
        "parent_block_id": "FIXTURE:parent_A",
        "scenario": {
          "votes": "FIXTURE:quorum_exactly_at_approved_threshold",
          "target_block": "FIXTURE:block_A",
          "validator_set": "FIXTURE:validator_set_0"
        }
      },
      "expected": {
        "decision": "FINALIZE",
        "error_code": "E_QUORUM_INSUFFICIENT",
        "decision_is_normative": false,
        "error_code_is_normative": false
      },
      "fixture_status": "PLACEHOLDERS_UNRESOLVED",
      "notes": "Contract-only expected behavior. Not executable protocol evidence; resolve all fixture references and freeze applicable parameters before protocol execution."
    },
    {
      "case_id": "POS-V-004",
      "kind": "positive",
      "title": "deterministic fork choice",
      "contract_status": "BLOCKED",
      "blocked_by_parameters": [
        "PARAM-03",
        "PARAM-10"
      ],
      "input": {
        "contract_id": "ATC-POS-CONFORMANCE-001",
        "chain_id": 658467,
        "protocol_version": "UNFROZEN",
        "epoch": "FIXTURE:epoch_0",
        "height": "FIXTURE:height_1",
        "round": "FIXTURE:round_0",
        "validator_set_hash": "FIXTURE:validator_set_hash_0",
        "parent_block_id": "FIXTURE:parent_A",
        "scenario": {
          "valid_candidates": [
            "FIXTURE:block_A",
            "FIXTURE:block_B"
          ],
          "delivery_orders": [
            "FIXTURE:order_AB",
            "FIXTURE:order_BA"
          ],
          "compare": [
            "selected_block_id",
            "state_hash"
          ]
        }
      },
      "expected": {
        "decision": "ACCEPT",
        "error_code": "E_FORK_CHOICE_NONDETERMINISTIC",
        "decision_is_normative": false,
        "error_code_is_normative": false
      },
      "fixture_status": "PLACEHOLDERS_UNRESOLVED",
      "notes": "Contract-only expected behavior. Not executable protocol evidence; resolve all fixture references and freeze applicable parameters before protocol execution."
    },
    {
      "case_id": "POS-V-005",
      "kind": "positive",
      "title": "validator snapshot transition",
      "contract_status": "BLOCKED",
      "blocked_by_parameters": [
        "PARAM-01",
        "PARAM-02",
        "PARAM-06"
      ],
      "input": {
        "contract_id": "ATC-POS-CONFORMANCE-001",
        "chain_id": 658467,
        "protocol_version": "UNFROZEN",
        "epoch": "FIXTURE:epoch_0",
        "height": "FIXTURE:height_1",
        "round": "FIXTURE:round_0",
        "validator_set_hash": "FIXTURE:validator_set_hash_0",
        "parent_block_id": "FIXTURE:parent_A",
        "scenario": {
          "state_before": "FIXTURE:state_epoch_0",
          "stake_changes": "FIXTURE:stake_delta_epoch_1",
          "activation_boundary": "FIXTURE:approved_epoch_boundary"
        }
      },
      "expected": {
        "decision": "ACCEPT",
        "error_code": "E_VALIDATOR_SNAPSHOT_MISMATCH",
        "decision_is_normative": false,
        "error_code_is_normative": false
      },
      "fixture_status": "PLACEHOLDERS_UNRESOLVED",
      "notes": "Contract-only expected behavior. Not executable protocol evidence; resolve all fixture references and freeze applicable parameters before protocol execution."
    },
    {
      "case_id": "POS-V-006",
      "kind": "positive",
      "title": "valid round change",
      "contract_status": "BLOCKED",
      "blocked_by_parameters": [
        "PARAM-05",
        "PARAM-07",
        "PARAM-08"
      ],
      "input": {
        "contract_id": "ATC-POS-CONFORMANCE-001",
        "chain_id": 658467,
        "protocol_version": "UNFROZEN",
        "epoch": "FIXTURE:epoch_0",
        "height": "FIXTURE:height_1",
        "round": "FIXTURE:round_0",
        "validator_set_hash": "FIXTURE:validator_set_hash_0",
        "parent_block_id": "FIXTURE:parent_A",
        "scenario": {
          "round_change": "FIXTURE:valid_round_change_A",
          "highest_qc": "FIXTURE:valid_qc_A",
          "signers": "FIXTURE:round_change_quorum_signers"
        }
      },
      "expected": {
        "decision": "ACCEPT",
        "error_code": "E_ROUND_CHANGE_INVALID",
        "decision_is_normative": false,
        "error_code_is_normative": false
      },
      "fixture_status": "PLACEHOLDERS_UNRESOLVED",
      "notes": "Contract-only expected behavior. Not executable protocol evidence; resolve all fixture references and freeze applicable parameters before protocol execution."
    },
    {
      "case_id": "POS-V-007",
      "kind": "positive",
      "title": "recovery without finality regression",
      "contract_status": "BLOCKED",
      "blocked_by_parameters": [
        "PARAM-08",
        "PARAM-11"
      ],
      "input": {
        "contract_id": "ATC-POS-CONFORMANCE-001",
        "chain_id": 658467,
        "protocol_version": "UNFROZEN",
        "epoch": "FIXTURE:epoch_0",
        "height": "FIXTURE:height_1",
        "round": "FIXTURE:round_0",
        "validator_set_hash": "FIXTURE:validator_set_hash_0",
        "parent_block_id": "FIXTURE:parent_A",
        "scenario": {
          "pre_partition_finality": "FIXTURE:finalized_block_A",
          "partition_messages": "FIXTURE:partition_messages_valid",
          "rejoin_messages": "FIXTURE:rejoin_messages_valid",
          "certificate": "FIXTURE:valid_finality_certificate_A"
        }
      },
      "expected": {
        "decision": "ACCEPT",
        "error_code": "E_FINALITY_REGRESSION",
        "decision_is_normative": false,
        "error_code_is_normative": false
      },
      "fixture_status": "PLACEHOLDERS_UNRESOLVED",
      "notes": "Contract-only expected behavior. Not executable protocol evidence; resolve all fixture references and freeze applicable parameters before protocol execution."
    },
    {
      "case_id": "POS-N-001",
      "kind": "negative",
      "title": "wrong domain or replay",
      "contract_status": "BLOCKED",
      "blocked_by_parameters": [
        "PARAM-03",
        "PARAM-07"
      ],
      "input": {
        "contract_id": "ATC-POS-CONFORMANCE-001",
        "chain_id": 658467,
        "protocol_version": "UNFROZEN",
        "epoch": "FIXTURE:epoch_0",
        "height": "FIXTURE:height_1",
        "round": "FIXTURE:round_0",
        "validator_set_hash": "FIXTURE:validator_set_hash_0",
        "parent_block_id": "FIXTURE:parent_A",
        "scenario": {
          "message": "FIXTURE:valid_vote_A",
          "mutation": {